
> archipelago-json@1.0.0 test
> node scripts/test/run-tests.js

[WebServer] 127.0.0.1 - - [13/Nov/2025 04:50:09] "GET / HTTP/1.1" 200 -

Running 1 test using 1 worker

PW DEBUG: Navigating to application with parameters:
  - mode: test-spoilers
  - game: soe
  - seed: 1
PW DEBUG: URL: http://localhost:8000/frontend/?mode=test-spoilers&game=soe&seed=1
[WebServer] 127.0.0.1 - - [13/Nov/2025 04:50:31] "GET /frontend/?mode=test-spoilers&game=soe&seed=1 HTTP/1.1" 200 -
[WebServer] 127.0.0.1 - - [13/Nov/2025 04:50:31] "GET /frontend/styles/index.css HTTP/1.1" 200 -
[WebServer] 127.0.0.1 - - [13/Nov/2025 04:50:31] "GET /frontend/styles/loading-screen.css HTTP/1.1" 200 -
[WebServer] 127.0.0.1 - - [13/Nov/2025 04:50:31] "GET /frontend/libs/golden-layout/css/themes/goldenlayout-dark-theme.css HTTP/1.1" 200 -
[WebServer] 127.0.0.1 - - [13/Nov/2025 04:50:31] "GET /frontend/styles/mobile.css HTTP/1.1" 200 -
[WebServer] 127.0.0.1 - - [13/Nov/2025 04:50:31] "GET /frontend/libs/golden-layout/css/goldenlayout-base.css HTTP/1.1" 200 -
[WebServer] 127.0.0.1 - - [13/Nov/2025 04:50:31] "GET /frontend/libs/json-editor/jsoneditor.js HTTP/1.1" 200 -
[WebServer] 127.0.0.1 - - [13/Nov/2025 04:50:31] "GET /frontend/libs/vanilla-jsoneditor/themes/jse-theme-dark.css HTTP/1.1" 200 -
[WebServer] 127.0.0.1 - - [13/Nov/2025 04:50:31] "GET /frontend/init.js HTTP/1.1" 200 -
[WebServer] 127.0.0.1 - - [13/Nov/2025 04:50:32] "GET /frontend/app/core/loggerService.js HTTP/1.1" 200 -
[WebServer] 127.0.0.1 - - [13/Nov/2025 04:50:32] "GET /frontend/app/core/panelManager.js HTTP/1.1" 200 -
[WebServer] 127.0.0.1 - - [13/Nov/2025 04:50:32] "GET /frontend/app/core/eventBus.js HTTP/1.1" 200 -
[WebServer] 127.0.0.1 - - [13/Nov/2025 04:50:32] "GET /frontend/app/core/settingsManager.js HTTP/1.1" 200 -
[WebServer] 127.0.0.1 - - [13/Nov/2025 04:50:32] "GET /frontend/app/core/centralRegistry.js HTTP/1.1" 200 -
[WebServer] 127.0.0.1 - - [13/Nov/2025 04:50:32] "GET /frontend/app/core/eventDispatcher.js HTTP/1.1" 200 -
[WebServer] 127.0.0.1 - - [13/Nov/2025 04:50:32] "GET /frontend/libs/golden-layout/js/esm/golden-layout.js HTTP/1.1" 200 -
[WebServer] 127.0.0.1 - - [13/Nov/2025 04:50:32] "GET /frontend/app/core/mobileLayoutManager.js HTTP/1.1" 200 -
[WebServer] 127.0.0.1 - - [13/Nov/2025 04:50:32] "GET /frontend/app/initialization/index.js HTTP/1.1" 200 -
[WebServer] 127.0.0.1 - - [13/Nov/2025 04:50:32] "GET /frontend/app/initialization/fileLoadingUI.js HTTP/1.1" 200 -
[WebServer] 127.0.0.1 - - [13/Nov/2025 04:50:32] "GET /frontend/app/mode/modeManager.js HTTP/1.1" 200 -
[WebServer] 127.0.0.1 - - [13/Nov/2025 04:50:32] "GET /frontend/app/mode/modeConfigResolver.js HTTP/1.1" 200 -
[WebServer] 127.0.0.1 - - [13/Nov/2025 04:50:32] "GET /frontend/app/mode/modeDataLoader.js HTTP/1.1" 200 -
[WebServer] 127.0.0.1 - - [13/Nov/2025 04:50:32] "GET /frontend/app/initialization/moduleLoader.js HTTP/1.1" 200 -
[WebServer] 127.0.0.1 - - [13/Nov/2025 04:50:32] "GET /frontend/app/initialization/moduleInitializer.js HTTP/1.1" 200 -
[WebServer] 127.0.0.1 - - [13/Nov/2025 04:50:32] "GET /frontend/app/initialization/layoutManager.js HTTP/1.1" 200 -
[WebServer] 127.0.0.1 - - [13/Nov/2025 04:50:32] "GET /frontend/app/initialization/apiFactory.js HTTP/1.1" 200 -
[WebServer] 127.0.0.1 - - [13/Nov/2025 04:50:32] "GET /frontend/app/layout/layoutLoader.js HTTP/1.1" 200 -
[WebServer] 127.0.0.1 - - [13/Nov/2025 04:50:32] "GET /frontend/app/layout/layoutFilter.js HTTP/1.1" 200 -
[WebServer] 127.0.0.1 - - [13/Nov/2025 04:50:32] "GET /frontend/utils/settingsMerger.js HTTP/1.1" 200 -
[WebServer] 127.0.0.1 - - [13/Nov/2025 04:50:32] "GET /frontend/app/layout/desktopLayout.js HTTP/1.1" 200 -
[WebServer] 127.0.0.1 - - [13/Nov/2025 04:50:32] "GET /frontend/app/core/moduleMetadata.js HTTP/1.1" 200 -
[WebServer] 127.0.0.1 - - [13/Nov/2025 04:50:32] "GET /frontend/modes.json HTTP/1.1" 200 -
BROWSER LOG (info): [Init - INFO] [Init] loadCombinedModeData started
[WebServer] 127.0.0.1 - - [13/Nov/2025 04:50:32] "GET /frontend/presets/preset_files.json HTTP/1.1" 200 -
[WebServer] 127.0.0.1 - - [13/Nov/2025 04:50:32] "GET /frontend/modules-test-spoilers.json HTTP/1.1" 200 -
[WebServer] 127.0.0.1 - - [13/Nov/2025 04:50:32] "GET /frontend/playwright_tests_config-spoilers.json HTTP/1.1" 200 -
[WebServer] 127.0.0.1 - - [13/Nov/2025 04:50:32] "GET /frontend/presets/soe/AP_14089154938208861744/AP_14089154938208861744_rules.json HTTP/1.1" 200 -
[WebServer] 127.0.0.1 - - [13/Nov/2025 04:50:32] "GET /frontend/layout_presets.json HTTP/1.1" 200 -
[WebServer] 127.0.0.1 - - [13/Nov/2025 04:50:32] "GET /frontend/settings.json HTTP/1.1" 200 -
BROWSER LOG (info): [Init - INFO] [Init] Created stateManager module_config with sourceName: ./presets/soe/AP_14089154938208861744/AP_14089154938208861744_rules.json (source: urlOverride)
BROWSER LOG (info): [04:50:32.220] [INFO] [INIT_STEP] Module import and registration phase started
[WebServer] 127.0.0.1 - - [13/Nov/2025 04:50:32] "GET /frontend/modules/stateManager/index.js HTTP/1.1" 200 -
[WebServer] 127.0.0.1 - - [13/Nov/2025 04:50:32] "GET /frontend/modules/stateManager/stateManagerProxySingleton.js HTTP/1.1" 200 -
[WebServer] 127.0.0.1 - - [13/Nov/2025 04:50:32] "GET /frontend/modules/stateManager/stateManagerProxy.js HTTP/1.1" 200 -
[WebServer] 127.0.0.1 - - [13/Nov/2025 04:50:32] "GET /frontend/modules/shared/ruleEngine.js HTTP/1.1" 200 -
[WebServer] 127.0.0.1 - - [13/Nov/2025 04:50:32] "GET /frontend/modules/shared/gameLogic/generic/genericLogic.js HTTP/1.1" 200 -
[WebServer] 127.0.0.1 - - [13/Nov/2025 04:50:32] "GET /frontend/modules/stateManager/stateManagerCommands.js HTTP/1.1" 200 -
[WebServer] 127.0.0.1 - - [13/Nov/2025 04:50:32] "GET /frontend/modules/shared/gameLogic/alttp/alttpLogic.js HTTP/1.1" 200 -
[WebServer] 127.0.0.1 - - [13/Nov/2025 04:50:32] "GET /frontend/modules/sphereState/index.js HTTP/1.1" 200 -
[WebServer] 127.0.0.1 - - [13/Nov/2025 04:50:32] "GET /frontend/modules/stateManager/stateManagerWorker.js HTTP/1.1" 200 -
[WebServer] 127.0.0.1 - - [13/Nov/2025 04:50:32] "GET /frontend/modules/sphereState/singleton.js HTTP/1.1" 200 -
[WebServer] 127.0.0.1 - - [13/Nov/2025 04:50:32] "GET /frontend/modules/sphereState/sphereState.js HTTP/1.1" 200 -
[WebServer] 127.0.0.1 - - [13/Nov/2025 04:50:32] "GET /frontend/modules/testSpoilers/index.js HTTP/1.1" 200 -
[WebServer] 127.0.0.1 - - [13/Nov/2025 04:50:32] "GET /frontend/modules/testSpoilers/testSpoilerUI.js HTTP/1.1" 200 -
[WebServer] 127.0.0.1 - - [13/Nov/2025 04:50:32] "GET /frontend/modules/commonUI/index.js HTTP/1.1" 200 -
[WebServer] 127.0.0.1 - - [13/Nov/2025 04:50:32] "GET /frontend/modules/shared/stateInterface.js HTTP/1.1" 200 -
[WebServer] 127.0.0.1 - - [13/Nov/2025 04:50:32] "GET /frontend/modules/testSpoilers/testSpoilerRuleEvaluator.js HTTP/1.1" 200 -
[WebServer] 127.0.0.1 - - [13/Nov/2025 04:50:32] "GET /frontend/modules/testSpoilers/fileLoader.js HTTP/1.1" 200 -
[WebServer] 127.0.0.1 - - [13/Nov/2025 04:50:32] "GET /frontend/modules/testSpoilers/comparisonEngine.js HTTP/1.1" 200 -
[WebServer] 127.0.0.1 - - [13/Nov/2025 04:50:32] "GET /frontend/modules/testSpoilers/analysisReporter.js HTTP/1.1" 200 -
[WebServer] 127.0.0.1 - - [13/Nov/2025 04:50:32] "GET /frontend/modules/testSpoilers/eventProcessor.js HTTP/1.1" 200 -
[WebServer] 127.0.0.1 - - [13/Nov/2025 04:50:32] "GET /frontend/modules/testSpoilers/testOrchestrator.js HTTP/1.1" 200 -
[WebServer] 127.0.0.1 - - [13/Nov/2025 04:50:32] "GET /frontend/app/core/universalLogger.js HTTP/1.1" 200 -
[WebServer] 127.0.0.1 - - [13/Nov/2025 04:50:32] "GET /frontend/modules/commonUI/commonUI.js HTTP/1.1" 200 -
[WebServer] 127.0.0.1 - - [13/Nov/2025 04:50:32] "GET /frontend/modules/shared/gameLogic/gameLogicRegistry.js HTTP/1.1" 200 -
[WebServer] 127.0.0.1 - - [13/Nov/2025 04:50:32] "GET /frontend/modules/shared/gameLogic/ahit/ahitLogic.js HTTP/1.1" 200 -
[WebServer] 127.0.0.1 - - [13/Nov/2025 04:50:32] "GET /frontend/modules/shared/gameLogic/aquaria/aquariaLogic.js HTTP/1.1" 200 -
[WebServer] 127.0.0.1 - - [13/Nov/2025 04:50:32] "GET /frontend/modules/shared/gameLogic/archipidle/archipidleLogic.js HTTP/1.1" 200 -
[WebServer] 127.0.0.1 - - [13/Nov/2025 04:50:32] "GET /frontend/modules/shared/gameLogic/blasphemous/blasphemousLogic.js HTTP/1.1" 200 -
[WebServer] 127.0.0.1 - - [13/Nov/2025 04:50:32] "GET /frontend/modules/shared/gameLogic/bomb_rush_cyberfunk/bombRushCyberfunkLogic.js HTTP/1.1" 200 -
[WebServer] 127.0.0.1 - - [13/Nov/2025 04:50:32] "GET /frontend/modules/shared/gameLogic/celeste64/celeste64Logic.js HTTP/1.1" 200 -
[WebServer] 127.0.0.1 - - [13/Nov/2025 04:50:32] "GET /frontend/modules/shared/gameLogic/civ_6/civ6Logic.js HTTP/1.1" 200 -
[WebServer] 127.0.0.1 - - [13/Nov/2025 04:50:32] "GET /frontend/modules/stateManager/stateManager.js HTTP/1.1" 200 -
[WebServer] 127.0.0.1 - - [13/Nov/2025 04:50:32] "GET /frontend/modules/shared/gameLogic/cvcotm/cvcotmLogic.js HTTP/1.1" 200 -
[WebServer] 127.0.0.1 - - [13/Nov/2025 04:50:32] "GET /frontend/modules/shared/gameLogic/dlcquest/dlcquestLogic.js HTTP/1.1" 200 -
[WebServer] 127.0.0.1 - - [13/Nov/2025 04:50:32] "GET /frontend/modules/shared/gameLogic/hk/hkLogic.js HTTP/1.1" 200 -
[WebServer] 127.0.0.1 - - [13/Nov/2025 04:50:32] "GET /frontend/modules/shared/gameLogic/hylics_2/hylics2Logic.js HTTP/1.1" 200 -
[WebServer] 127.0.0.1 - - [13/Nov/2025 04:50:32] "GET /frontend/modules/shared/gameLogic/inscryption/inscryptionLogic.js HTTP/1.1" 200 -
[WebServer] 127.0.0.1 - - [13/Nov/2025 04:50:32] "GET /frontend/modules/shared/gameLogic/jak_and_daxter__the_precursor_legacy/jak_and_daxter__the_precursor_legacyLogic.js HTTP/1.1" 200 -
[WebServer] 127.0.0.1 - - [13/Nov/2025 04:50:32] "GET /frontend/modules/shared/gameLogic/kh1/kh1Logic.js HTTP/1.1" 200 -
[WebServer] 127.0.0.1 - - [13/Nov/2025 04:50:32] "GET /frontend/modules/shared/gameLogic/kh2/kh2Logic.js HTTP/1.1" 200 -
[WebServer] 127.0.0.1 - - [13/Nov/2025 04:50:32] "GET /frontend/modules/shared/gameLogic/kdl3/kdl3Logic.js HTTP/1.1" 200 -
[WebServer] 127.0.0.1 - - [13/Nov/2025 04:50:32] "GET /frontend/modules/shared/gameLogic/ladx/ladxLogic.js HTTP/1.1" 200 -
[WebServer] 127.0.0.1 - - [13/Nov/2025 04:50:32] "GET /frontend/modules/shared/gameLogic/landstalker/landstalkerLogic.js HTTP/1.1" 200 -
[WebServer] 127.0.0.1 - - [13/Nov/2025 04:50:32] "GET /frontend/modules/shared/gameLogic/lingo/lingoLogic.js HTTP/1.1" 200 -
[WebServer] 127.0.0.1 - - [13/Nov/2025 04:50:32] "GET /frontend/modules/shared/gameLogic/mlss/mlssLogic.js HTTP/1.1" 200 -
[WebServer] 127.0.0.1 - - [13/Nov/2025 04:50:32] "GET /frontend/modules/shared/gameLogic/mmbn3/mmbn3Logic.js HTTP/1.1" 200 -
[WebServer] 127.0.0.1 - - [13/Nov/2025 04:50:32] "GET /frontend/modules/shared/gameLogic/pokemon_rb/pokemon_rbLogic.js HTTP/1.1" 200 -
[WebServer] 127.0.0.1 - - [13/Nov/2025 04:50:32] "GET /frontend/modules/shared/gameLogic/mm2/mm2Logic.js HTTP/1.1" 200 -
[WebServer] 127.0.0.1 - - [13/Nov/2025 04:50:32] "GET /frontend/modules/shared/gameLogic/oot/ootLogic.js HTTP/1.1" 200 -
[WebServer] 127.0.0.1 - - [13/Nov/2025 04:50:32] "GET /frontend/modules/shared/gameLogic/sm64ex/sm64exLogic.js HTTP/1.1" 200 -
[WebServer] 127.0.0.1 - - [13/Nov/2025 04:50:32] "GET /frontend/modules/shared/gameLogic/v6/v6Logic.js HTTP/1.1" 200 -
[WebServer] 127.0.0.1 - - [13/Nov/2025 04:50:32] "GET /frontend/modules/shared/gameLogic/yachtdice/yachtdiceLogic.js HTTP/1.1" 200 -
[WebServer] 127.0.0.1 - - [13/Nov/2025 04:50:32] "GET /frontend/modules/stateManager/core/commandQueue.js HTTP/1.1" 200 -
[WebServer] 127.0.0.1 - - [13/Nov/2025 04:50:32] "GET /frontend/modules/stateManager/core/initialization.js HTTP/1.1" 200 -
[WebServer] 127.0.0.1 - - [13/Nov/2025 04:50:32] "GET /frontend/modules/stateManager/core/inventoryManager.js HTTP/1.1" 200 -
[WebServer] 127.0.0.1 - - [13/Nov/2025 04:50:32] "GET /frontend/modules/stateManager/core/reachabilityEngine.js HTTP/1.1" 200 -
[WebServer] 127.0.0.1 - - [13/Nov/2025 04:50:32] "GET /frontend/modules/stateManager/core/statePersistence.js HTTP/1.1" 200 -
[WebServer] 127.0.0.1 - - [13/Nov/2025 04:50:32] "GET /frontend/modules/stateManager/core/locationChecking.js HTTP/1.1" 200 -
[WebServer] 127.0.0.1 - - [13/Nov/2025 04:50:32] "GET /frontend/modules/stateManager/core/ruleEvaluator.js HTTP/1.1" 200 -
[WebServer] 127.0.0.1 - - [13/Nov/2025 04:50:32] "GET /frontend/modules/shared/gameLogic/ladx/helpers.js HTTP/1.1" 200 -
[WebServer] 127.0.0.1 - - [13/Nov/2025 04:50:32] "GET /frontend/modules/stateManager/core/batchUpdateManager.js HTTP/1.1" 200 -
[WebServer] 127.0.0.1 - - [13/Nov/2025 04:50:32] "GET /frontend/modules/shared/gameLogic/mmbn3/helpers.js HTTP/1.1" 200 -
[WebServer] 127.0.0.1 - - [13/Nov/2025 04:50:32] "GET /frontend/modules/shared/gameLogic/sm64ex/helpers.js HTTP/1.1" 200 -
[WebServer] 127.0.0.1 - - [13/Nov/2025 04:50:32] "GET /frontend/modules/shared/gameLogic/yachtdice/helpers.js HTTP/1.1" 200 -
[WebServer] 127.0.0.1 - - [13/Nov/2025 04:50:32] "GET /frontend/modules/shared/gameLogic/yachtdice/yacht_weights.json HTTP/1.1" 200 -
[WebServer] 127.0.0.1 - - [13/Nov/2025 04:50:32] "GET /frontend/modules/tests/index.js HTTP/1.1" 200 -
BROWSER LOG (log): [YachtDice] yacht_weights data loaded successfully
[WebServer] 127.0.0.1 - - [13/Nov/2025 04:50:32] "GET /frontend/modules/tests/testUI.js HTTP/1.1" 200 -
BROWSER LOG (log): [universalLogger] Worker logger initialized
[WebServer] 127.0.0.1 - - [13/Nov/2025 04:50:32] "GET /frontend/modules/tests/testLogic.js HTTP/1.1" 200 -
[WebServer] 127.0.0.1 - - [13/Nov/2025 04:50:32] "GET /frontend/modules/tests/testController.js HTTP/1.1" 200 -
[WebServer] 127.0.0.1 - - [13/Nov/2025 04:50:32] "GET /frontend/modules/tests/testState.js HTTP/1.1" 200 -
[WebServer] 127.0.0.1 - - [13/Nov/2025 04:50:32] "GET /frontend/modules/tests/testDiscovery.js HTTP/1.1" 200 -
BROWSER LOG (log): [YachtDice] yacht_weights data loaded successfully
[WebServer] 127.0.0.1 - - [13/Nov/2025 04:50:32] "GET /frontend/modules/tests/testRegistry.js HTTP/1.1" 200 -
BROWSER LOG (info): [04:50:32.615] [INFO] [INIT_STEP] Module import and registration phase completed
BROWSER LOG (info): [04:50:32.617] [INFO] [INIT_STEP] Golden Layout initialization started
[WebServer] 127.0.0.1 - - [13/Nov/2025 04:50:32] "GET /frontend/modules/tests/testCases/coreTests.js HTTP/1.1" 200 -
[WebServer] 127.0.0.1 - - [13/Nov/2025 04:50:32] "GET /frontend/libs/golden-layout/img/lm_close_white.png HTTP/1.1" 200 -
[WebServer] 127.0.0.1 - - [13/Nov/2025 04:50:32] "GET /frontend/libs/golden-layout/img/lm_maximise_white.png HTTP/1.1" 200 -
BROWSER LOG (info): [04:50:32.768] [INFO] [INIT_STEP] Golden Layout initialization completed
BROWSER LOG (info): [04:50:32.768] [INFO] [INIT_STEP] Module initialization phase started (4 modules)
BROWSER LOG (info): [04:50:32.769] [INFO] [INIT_STEP] Module initialization phase completed (4 modules)
BROWSER LOG (info): [04:50:32.770] [INFO] [INIT_STEP] Module post-initialization phase started (1 modules)
BROWSER LOG (debug): [Init - DEBUG] [Init _postInitializeSingleModule] Original genericModuleSpecificConfig FOR stateManager: {rulesConfig: Object, sourceName: ./presets/soe/AP_14089154938208861744/AP_14089154938208861744_rules.json}
BROWSER LOG (info): [Init - INFO] [Init _postInitializeSingleModule] Derived sourceName for StateManager: ./presets/soe/AP_14089154938208861744/AP_14089154938208861744_rules.json (source: urlOverride)
BROWSER LOG (info): [Init - INFO] [Init _postInitializeSingleModule] EXACT configForPostInitialize BEING PASSED to stateManager.postInitialize: {rulesConfig: Object, sourceName: ./presets/soe/AP_14089154938208861744/AP_14089154938208861744_rules.json}
BROWSER LOG (info): [04:50:32.775] [INFO] [INIT_STEP] Module post-initialization phase completed (1 modules)
BROWSER LOG (debug): [stateManagerProxy] Snapshot cached from rulesLoadedConfirmation.
[WebServer] 127.0.0.1 - - [13/Nov/2025 04:50:33] "GET /frontend/presets/soe/AP_14089154938208861744/AP_14089154938208861744_spheres_log.jsonl HTTP/1.1" 200 -
[WebServer] 127.0.0.1 - - [13/Nov/2025 04:50:33] "GET /frontend/modules/tests/testCases/locationPanelTests.js HTTP/1.1" 200 -
[WebServer] 127.0.0.1 - - [13/Nov/2025 04:50:33] "GET /frontend/modules/tests/testCases/exitPanelTests.js HTTP/1.1" 200 -
[WebServer] 127.0.0.1 - - [13/Nov/2025 04:50:33] "GET /frontend/modules/tests/testCases/regionPanelTests.js HTTP/1.1" 200 -
[WebServer] 127.0.0.1 - - [13/Nov/2025 04:50:33] "GET /frontend/modules/tests/testCases/regionGraphPanelTests.js HTTP/1.1" 200 -
[WebServer] 127.0.0.1 - - [13/Nov/2025 04:50:33] "GET /frontend/modules/tests/testCases/loopsPanelTests.js HTTP/1.1" 200 -
[WebServer] 127.0.0.1 - - [13/Nov/2025 04:50:33] "GET /frontend/modules/tests/testCases/eventsPanelTests.js HTTP/1.1" 200 -
[WebServer] 127.0.0.1 - - [13/Nov/2025 04:50:33] "GET /frontend/modules/tests/testCases/pathAnalyzerTests.js HTTP/1.1" 200 -
[WebServer] 127.0.0.1 - - [13/Nov/2025 04:50:33] "GET /frontend/modules/tests/testCases/settingsPanelTests.js HTTP/1.1" 200 -
[WebServer] 127.0.0.1 - - [13/Nov/2025 04:50:33] "GET /frontend/modules/tests/testCases/JSONPanelTests.js HTTP/1.1" 200 -
[WebServer] 127.0.0.1 - - [13/Nov/2025 04:50:33] "GET /frontend/modules/tests/testCases/progressBarTests.js HTTP/1.1" 200 -
[WebServer] 127.0.0.1 - - [13/Nov/2025 04:50:33] "GET /frontend/modules/tests/testCases/metaGamePanelTests.js HTTP/1.1" 200 -
[WebServer] 127.0.0.1 - - [13/Nov/2025 04:50:33] "GET /frontend/modules/tests/testCases/textAdventurePanelTests.js HTTP/1.1" 200 -
[WebServer] 127.0.0.1 - - [13/Nov/2025 04:50:33] "GET /frontend/modules/tests/testCases/textAdventure-iframeTests.js HTTP/1.1" 200 -
[WebServer] 127.0.0.1 - - [13/Nov/2025 04:50:33] "GET /frontend/modules/tests/testCases/textAdventure-windowTests.js HTTP/1.1" 200 -
[WebServer] 127.0.0.1 - - [13/Nov/2025 04:50:33] "GET /frontend/modules/tests/testCases/iframe-baseTests.js HTTP/1.1" 200 -
[WebServer] 127.0.0.1 - - [13/Nov/2025 04:50:33] "GET /frontend/modules/tests/testCases/window-baseTests.js HTTP/1.1" 200 -
[WebServer] 127.0.0.1 - - [13/Nov/2025 04:50:33] "GET /frontend/modules/tests/testCases/timerTests.js HTTP/1.1" 200 -
[WebServer] 127.0.0.1 - - [13/Nov/2025 04:50:33] "GET /frontend/modules/tests/testCases/multiplayerTests.js HTTP/1.1" 200 -
[WebServer] 127.0.0.1 - - [13/Nov/2025 04:50:33] "GET /frontend/modules/tests/testCases/testSpoilersPanelTests.js HTTP/1.1" 200 -
PW DEBUG: Page navigation complete (network idle).
PW DEBUG: Starting to wait for __playwrightTestsComplete__ flag on window...
BROWSER LOG (error): [04:50:34.806] [ERROR] [testSpoilerUI] STATE MISMATCH found for: {"type":"state_update","sphere_number":0,"player_id":"1"}
BROWSER LOG (error): [04:50:34.808] [ERROR] [testSpoilerUI:ComparisonEngine] STATE MISMATCH found for: {"type":"state_update","sphere_number":0,"player_id":"1"}
BROWSER LOG (error): [04:50:34.815] [ERROR] [testSpoilerUI]  > Locations accessible in STATE (and unchecked) but NOT in LOG: S. Jungle w/ weapon #2, S. Jungle w/ weapon #3, S. Jungle w/ weapon #5, Strongheart's Hut #6, Strongheart's Hut #7, Strongheart's Hut #8, Blimp's Hut #10, Blimp's Hut #11, Blimp's Hut #12, N. Jungle #55, N. Jungle #56, Volcano Path #59, Volcano Path #60, Volcano Path #61, West of Swamp #62, West of Swamp #63, Swamp #64, Swamp #65, Swamp #66, Swamp #67, Swamp #68, Swamp #69, Swamp #70, Volcano Shop #71, Volcano Shop #72, Arena Holding #95, Arena Holding #96, Arena Holding #97, Arena Holding #98, Arena Holding #99, Arena Holding #100, Arena Holding #101, Arena Holding #102, Blimp's Cave #109, Blimp's Cave #110, Crustacia Interior #111, Crustacia Interior #112, Crustacia Interior #113, Crustacia Interior #114, Crustacia Interior #115, Crustacia Interior #116, Volcano Path Cave #182, Volcano Path Cave #183, Ebon Sewers #190, Ebon Sewers #191, Ebon Sewers #192, Ebon Sewers #193, Ebon Sewers #194, Outside Ivor #199, Outside Ivor #200, Outside Ivor #201, Outside Ivor #202, Ivor Houses #203, Ivor Houses #204, Ivor Houses #205, Ivor Houses #206, Ebon Houses #207, Ivor Houses #208, Ebon Houses #209, Ivor Houses #210, Ebon Houses #211, Ivor Houses #212, Ebon Houses #213, Ivor Houses #214, Ebon Houses #215, Ivor Houses #216, Ebon Houses #217, Ivor Houses #218, Ebon Houses #219, Ivor Houses #220, Ebon Houses #221, Ivor Houses #222, Ebon Houses #223, Ivor Houses #224, Ebon Houses #225, Ivor Houses #226, Ebon Houses #227, Ivor Houses #228, Ebon Houses #229, Ivor Houses #230, Ebon Houses #231, Ivor Houses #232, Ebon Houses #233, Ivor Houses #234, Ebon Houses #235, Ivor Houses #236, Ebon Houses #237, Ivor Houses #238, Ebon Houses #239, Ivor Houses #240, Ebon Houses #241, Ivor Houses #242, Ebon Houses #243, Ivor Houses #244, Ebon Houses #245, Ivor Houses #246, Ebon Houses #247, Ebon Houses #248, Naris #249, Naris #250, Tinker #251, Ebon Dining #252, Ivor Dining #253, Ivor Dining #254, Ivor Upper Floor #261, Ivor Upper Floor #262, Ivor Sewers #263, Ivor Sewers #264, Ivor Sewers #265, Ivor Sewers #266, Ivor Sewers #267, Ivor Sewers #268, Ivor Sewers #269, Ivor Sewers #270, Ebon Storage #271, Ebon Storage #272, Ebon Storage #273, Coleoptera, Mammoth Viper, Cave Raptors, Salabog, Vigor, Bad Boys, Timberdrake, Verminator, Footknight, Atlas, Corrosion, Crush, Cure, Explosion, Heal, Lance, Miracle Cure, One Up, Regrowth, Revealer, Revive, Slow Burn, Sting, Super Heal, Vanilla Gauge #57, Volcano Path #58, Volcano Room1 #73, Volcano Room1 #74, Volcano Room1 #75, Volcano Room1 #76, Volcano Room1 #77, Volcano Room1 #78, Volcano Room1 #79, Volcano Room1 #80, Volcano Room2 #81, Volcano Room2 #82, Volcano Room2 #83, Volcano Room2 #84, Volcano Room2 #85, Volcano Room2 #86, Volcano Room2 #87, Volcano Room2 #88, Pipe Maze #89, Pipe Maze #90, Pipe Maze #91, Pipe Maze #92, Pipe Maze #93, Pipe Maze #94, W. Crustacia #103, W. Crustacia #104, W. Crustacia #105, W. Crustacia #106, E. Crustacia #107, E. Crustacia #108, Pyramid bottom #117, Pyramid bottom #118, Pyramid bottom #119, Pyramid bottom #120, Pyramid bottom #121, Pyramid bottom #122, Pyramid bottom #123, Pyramid bottom #124, Pyramid bottom #125, Pyramid bottom #126, Pyramid bottom #127, Pyramid bottom #128, Pyramid bottom #129, Pyramid bottom #130, Pyramid bottom #131, Pyramid bottom #132, Pyramid bottom #133, Pyramid bottom #134, Pyramid top #135, Pyramid top #136, Pyramid top #137, Pyramid top #138, Pyramid top #139, Pyramid top #140, Pyramid top #141, Pyramid top #142, Pyramid top #143, Pyramid top #144, Pyramid top #145, Pyramid top #146, Pyramid top #147, Pyramid top #148, Pyramid top #149, Pyramid top #150, Pyramid top #151, Pyramid top #152, Pyramid top #153, Pyramid top #154, Pyramid top #155, Pyramid top #156, Pyramid top #157, Tiny's hideout #158, Tiny's hideout #159, Tiny's hideout #160, Tiny's hideout #161, Tiny's hideout #162, Tiny's hideout #163, Tiny's hideout #164, Halls Main Room #165, Halls Main Room #166, Halls SW #167, Halls SW #168, Halls SW #169, Halls NW #170, Halls NW #171, Halls NW #172, Halls NW #173, Halls NE #174, Halls NE #175, Halls NE #176, Halls NE #177, Halls Bridge #178, Oglin Cave #179, Drain Cave #180, Drain Cave #181, Gomi's Tower #195, Gomi's Tower #196, Gomi's Tower #197, Gomi's Tower #198, Ivor East #255, Ivor East #256, Ivor East #257, Ivor East #258, Ivor East #259, Ivor East #260, Prof. Lab #274, Greenhouse #275, Alarm room #276, Reactor room #277, Storage room #278, Storage room #279, Storage room #280, Storage room #281, Storage room #282, Storage room #283, Storage room #284, Energy Core #285, Megataur, Rimsala, Aquagoth, Tiny, Mungola, Sons of Sth., Volcano Viper, Magmar, Mad Monk, Barrier, Call Up, Double Drain, Drain, Energize, Escape, Fireball, Fire Power, Force Field, Levitate, Lightning Storm, Nitro, Reflect, Speed, Stop
BROWSER LOG (error): [04:50:34.816] [ERROR] [testSpoilerUI:ComparisonEngine]  > Locations accessible in STATE (and unchecked) but NOT in LOG: S. Jungle w/ weapon #2, S. Jungle w/ weapon #3, S. Jungle w/ weapon #5, Strongheart's Hut #6, Strongheart's Hut #7, Strongheart's Hut #8, Blimp's Hut #10, Blimp's Hut #11, Blimp's Hut #12, N. Jungle #55, N. Jungle #56, Volcano Path #59, Volcano Path #60, Volcano Path #61, West of Swamp #62, West of Swamp #63, Swamp #64, Swamp #65, Swamp #66, Swamp #67, Swamp #68, Swamp #69, Swamp #70, Volcano Shop #71, Volcano Shop #72, Arena Holding #95, Arena Holding #96, Arena Holding #97, Arena Holding #98, Arena Holding #99, Arena Holding #100, Arena Holding #101, Arena Holding #102, Blimp's Cave #109, Blimp's Cave #110, Crustacia Interior #111, Crustacia Interior #112, Crustacia Interior #113, Crustacia Interior #114, Crustacia Interior #115, Crustacia Interior #116, Volcano Path Cave #182, Volcano Path Cave #183, Ebon Sewers #190, Ebon Sewers #191, Ebon Sewers #192, Ebon Sewers #193, Ebon Sewers #194, Outside Ivor #199, Outside Ivor #200, Outside Ivor #201, Outside Ivor #202, Ivor Houses #203, Ivor Houses #204, Ivor Houses #205, Ivor Houses #206, Ebon Houses #207, Ivor Houses #208, Ebon Houses #209, Ivor Houses #210, Ebon Houses #211, Ivor Houses #212, Ebon Houses #213, Ivor Houses #214, Ebon Houses #215, Ivor Houses #216, Ebon Houses #217, Ivor Houses #218, Ebon Houses #219, Ivor Houses #220, Ebon Houses #221, Ivor Houses #222, Ebon Houses #223, Ivor Houses #224, Ebon Houses #225, Ivor Houses #226, Ebon Houses #227, Ivor Houses #228, Ebon Houses #229, Ivor Houses #230, Ebon Houses #231, Ivor Houses #232, Ebon Houses #233, Ivor Houses #234, Ebon Houses #235, Ivor Houses #236, Ebon Houses #237, Ivor Houses #238, Ebon Houses #239, Ivor Houses #240, Ebon Houses #241, Ivor Houses #242, Ebon Houses #243, Ivor Houses #244, Ebon Houses #245, Ivor Houses #246, Ebon Houses #247, Ebon Houses #248, Naris #249, Naris #250, Tinker #251, Ebon Dining #252, Ivor Dining #253, Ivor Dining #254, Ivor Upper Floor #261, Ivor Upper Floor #262, Ivor Sewers #263, Ivor Sewers #264, Ivor Sewers #265, Ivor Sewers #266, Ivor Sewers #267, Ivor Sewers #268, Ivor Sewers #269, Ivor Sewers #270, Ebon Storage #271, Ebon Storage #272, Ebon Storage #273, Coleoptera, Mammoth Viper, Cave Raptors, Salabog, Vigor, Bad Boys, Timberdrake, Verminator, Footknight, Atlas, Corrosion, Crush, Cure, Explosion, Heal, Lance, Miracle Cure, One Up, Regrowth, Revealer, Revive, Slow Burn, Sting, Super Heal, Vanilla Gauge #57, Volcano Path #58, Volcano Room1 #73, Volcano Room1 #74, Volcano Room1 #75, Volcano Room1 #76, Volcano Room1 #77, Volcano Room1 #78, Volcano Room1 #79, Volcano Room1 #80, Volcano Room2 #81, Volcano Room2 #82, Volcano Room2 #83, Volcano Room2 #84, Volcano Room2 #85, Volcano Room2 #86, Volcano Room2 #87, Volcano Room2 #88, Pipe Maze #89, Pipe Maze #90, Pipe Maze #91, Pipe Maze #92, Pipe Maze #93, Pipe Maze #94, W. Crustacia #103, W. Crustacia #104, W. Crustacia #105, W. Crustacia #106, E. Crustacia #107, E. Crustacia #108, Pyramid bottom #117, Pyramid bottom #118, Pyramid bottom #119, Pyramid bottom #120, Pyramid bottom #121, Pyramid bottom #122, Pyramid bottom #123, Pyramid bottom #124, Pyramid bottom #125, Pyramid bottom #126, Pyramid bottom #127, Pyramid bottom #128, Pyramid bottom #129, Pyramid bottom #130, Pyramid bottom #131, Pyramid bottom #132, Pyramid bottom #133, Pyramid bottom #134, Pyramid top #135, Pyramid top #136, Pyramid top #137, Pyramid top #138, Pyramid top #139, Pyramid top #140, Pyramid top #141, Pyramid top #142, Pyramid top #143, Pyramid top #144, Pyramid top #145, Pyramid top #146, Pyramid top #147, Pyramid top #148, Pyramid top #149, Pyramid top #150, Pyramid top #151, Pyramid top #152, Pyramid top #153, Pyramid top #154, Pyramid top #155, Pyramid top #156, Pyramid top #157, Tiny's hideout #158, Tiny's hideout #159, Tiny's hideout #160, Tiny's hideout #161, Tiny's hideout #162, Tiny's hideout #163, Tiny's hideout #164, Halls Main Room #165, Halls Main Room #166, Halls SW #167, Halls SW #168, Halls SW #169, Halls NW #170, Halls NW #171, Halls NW #172, Halls NW #173, Halls NE #174, Halls NE #175, Halls NE #176, Halls NE #177, Halls Bridge #178, Oglin Cave #179, Drain Cave #180, Drain Cave #181, Gomi's Tower #195, Gomi's Tower #196, Gomi's Tower #197, Gomi's Tower #198, Ivor East #255, Ivor East #256, Ivor East #257, Ivor East #258, Ivor East #259, Ivor East #260, Prof. Lab #274, Greenhouse #275, Alarm room #276, Reactor room #277, Storage room #278, Storage room #279, Storage room #280, Storage room #281, Storage room #282, Storage room #283, Storage room #284, Energy Core #285, Megataur, Rimsala, Aquagoth, Tiny, Mungola, Sons of Sth., Volcano Viper, Magmar, Mad Monk, Barrier, Call Up, Double Drain, Drain, Energize, Escape, Fireball, Fire Power, Force Field, Levitate, Lightning Storm, Nitro, Reflect, Speed, Stop
BROWSER LOG (error): [MISMATCH DETAIL] Extra in state (282): [S. Jungle w/ weapon #2, S. Jungle w/ weapon #3, S. Jungle w/ weapon #5, Strongheart's Hut #6, Strongheart's Hut #7, Strongheart's Hut #8, Blimp's Hut #10, Blimp's Hut #11, Blimp's Hut #12, N. Jungle #55, N. Jungle #56, Volcano Path #59, Volcano Path #60, Volcano Path #61, West of Swamp #62, West of Swamp #63, Swamp #64, Swamp #65, Swamp #66, Swamp #67, Swamp #68, Swamp #69, Swamp #70, Volcano Shop #71, Volcano Shop #72, Arena Holding #95, Arena Holding #96, Arena Holding #97, Arena Holding #98, Arena Holding #99, Arena Holding #100, Arena Holding #101, Arena Holding #102, Blimp's Cave #109, Blimp's Cave #110, Crustacia Interior #111, Crustacia Interior #112, Crustacia Interior #113, Crustacia Interior #114, Crustacia Interior #115, Crustacia Interior #116, Volcano Path Cave #182, Volcano Path Cave #183, Ebon Sewers #190, Ebon Sewers #191, Ebon Sewers #192, Ebon Sewers #193, Ebon Sewers #194, Outside Ivor #199, Outside Ivor #200, Outside Ivor #201, Outside Ivor #202, Ivor Houses #203, Ivor Houses #204, Ivor Houses #205, Ivor Houses #206, Ebon Houses #207, Ivor Houses #208, Ebon Houses #209, Ivor Houses #210, Ebon Houses #211, Ivor Houses #212, Ebon Houses #213, Ivor Houses #214, Ebon Houses #215, Ivor Houses #216, Ebon Houses #217, Ivor Houses #218, Ebon Houses #219, Ivor Houses #220, Ebon Houses #221, Ivor Houses #222, Ebon Houses #223, Ivor Houses #224, Ebon Houses #225, Ivor Houses #226, Ebon Houses #227, Ivor Houses #228, Ebon Houses #229, Ivor Houses #230, Ebon Houses #231, Ivor Houses #232, Ebon Houses #233, Ivor Houses #234, Ebon Houses #235, Ivor Houses #236, Ebon Houses #237, Ivor Houses #238, Ebon Houses #239, Ivor Houses #240, Ebon Houses #241, Ivor Houses #242, Ebon Houses #243, Ivor Houses #244, Ebon Houses #245, Ivor Houses #246, Ebon Houses #247, Ebon Houses #248, Naris #249, Naris #250]
BROWSER LOG (error): [04:50:37.647] [ERROR] [testSpoilerUI] Test failed at step 1: Comparison failed for event type 'state_update'.
BROWSER LOG (error): [04:50:37.651] [ERROR] [testSpoilerUI] Mismatch for event 1 (Sphere 0): Comparison for state_update at step 1 Failed
BROWSER LOG (warning): [04:50:37.654] [WARN] [testSpoilerUI] Test run halted due to "Stop on first error" being enabled.
BROWSER LOG (error): [04:50:37.656] [ERROR] [testSpoilerUI] Spoiler test completed with 1 mismatch(es). See logs above for details.
BROWSER LOG (error): [04:50:38.676] [ERROR] [TestRunner/test_spoiler_full_run] [spoilers-full-run-1763009433281] Spoiler test failed. Mismatches found in log:
BROWSER LOG (error): [04:50:38.677] [ERROR] [TestRunner/test_spoiler_full_run]   - Mismatch for event 1 (Sphere 0): Comparison for state_update at step 1 Failed
BROWSER LOG (error): [04:50:38.677] [ERROR] [TestRunner/test_spoiler_full_run]   - [4:50:34 AM] STATE MISMATCH found for: {"type":"state_update","sphere_number":0,"player_id":"1"}
BROWSER LOG (error): [04:50:38.677] [ERROR] [TestRunner/test_spoiler_full_run]   - [4:50:34 AM] > Locations accessible in STATE (and unchecked) but NOT in LOG: S. Jungle w/ weapon #2, S. Jungle w/ weapon #3, S. Jungle w/ weapon #5, Strongheart&#039;s Hut #6, Strongheart&#039;s Hut #7, Strongheart&#039;s Hut #8, Blimp&#039;s Hut #10, Blimp&#039;s Hut #11, Blimp&#039;s Hut #12, N. Jungle #55, N. Jungle #56, Volcano Path #59, Volcano Path #60, Volcano Path #61, West of Swamp #62, West of Swamp #63, Swamp #64, Swamp #65, Swamp #66, Swamp #67, Swamp #68, Swamp #69, Swamp #70, Volcano Shop #71, Volcano Shop #72, Arena Holding #95, Arena Holding #96, Arena Holding #97, Arena Holding #98, Arena Holding #99, Arena Holding #100, Arena Holding #101, Arena Holding #102, Blimp&#039;s Cave #109, Blimp&#039;s Cave #110, Crustacia Interior #111, Crustacia Interior #112, Crustacia Interior #113, Crustacia Interior #114, Crustacia Interior #115, Crustacia Interior #116, Volcano Path Cave #182, Volcano Path Cave #183, Ebon Sewers #190, Ebon Sewers #191, Ebon Sewers #192, Ebon Sewers #193, Ebon Sewers #194, Outside Ivor #199, Outside Ivor #200, Outside Ivor #201, Outside Ivor #202, Ivor Houses #203, Ivor Houses #204, Ivor Houses #205, Ivor Houses #206, Ebon Houses #207, Ivor Houses #208, Ebon Houses #209, Ivor Houses #210, Ebon Houses #211, Ivor Houses #212, Ebon Houses #213, Ivor Houses #214, Ebon Houses #215, Ivor Houses #216, Ebon Houses #217, Ivor Houses #218, Ebon Houses #219, Ivor Houses #220, Ebon Houses #221, Ivor Houses #222, Ebon Houses #223, Ivor Houses #224, Ebon Houses #225, Ivor Houses #226, Ebon Houses #227, Ivor Houses #228, Ebon Houses #229, Ivor Houses #230, Ebon Houses #231, Ivor Houses #232, Ebon Houses #233, Ivor Houses #234, Ebon Houses #235, Ivor Houses #236, Ebon Houses #237, Ivor Houses #238, Ebon Houses #239, Ivor Houses #240, Ebon Houses #241, Ivor Houses #242, Ebon Houses #243, Ivor Houses #244, Ebon Houses #245, Ivor Houses #246, Ebon Houses #247, Ebon Houses #248, Naris #249, Naris #250, Tinker #251, Ebon Dining #252, Ivor Dining #253, Ivor Dining #254, Ivor Upper Floor #261, Ivor Upper Floor #262, Ivor Sewers #263, Ivor Sewers #264, Ivor Sewers #265, Ivor Sewers #266, Ivor Sewers #267, Ivor Sewers #268, Ivor Sewers #269, Ivor Sewers #270, Ebon Storage #271, Ebon Storage #272, Ebon Storage #273, Coleoptera, Mammoth Viper, Cave Raptors, Salabog, Vigor, Bad Boys, Timberdrake, Verminator, Footknight, Atlas, Corrosion, Crush, Cure, Explosion, Heal, Lance, Miracle Cure, One Up, Regrowth, Revealer, Revive, Slow Burn, Sting, Super Heal, Vanilla Gauge #57, Volcano Path #58, Volcano Room1 #73, Volcano Room1 #74, Volcano Room1 #75, Volcano Room1 #76, Volcano Room1 #77, Volcano Room1 #78, Volcano Room1 #79, Volcano Room1 #80, Volcano Room2 #81, Volcano Room2 #82, Volcano Room2 #83, Volcano Room2 #84, Volcano Room2 #85, Volcano Room2 #86, Volcano Room2 #87, Volcano Room2 #88, Pipe Maze #89, Pipe Maze #90, Pipe Maze #91, Pipe Maze #92, Pipe Maze #93, Pipe Maze #94, W. Crustacia #103, W. Crustacia #104, W. Crustacia #105, W. Crustacia #106, E. Crustacia #107, E. Crustacia #108, Pyramid bottom #117, Pyramid bottom #118, Pyramid bottom #119, Pyramid bottom #120, Pyramid bottom #121, Pyramid bottom #122, Pyramid bottom #123, Pyramid bottom #124, Pyramid bottom #125, Pyramid bottom #126, Pyramid bottom #127, Pyramid bottom #128, Pyramid bottom #129, Pyramid bottom #130, Pyramid bottom #131, Pyramid bottom #132, Pyramid bottom #133, Pyramid bottom #134, Pyramid top #135, Pyramid top #136, Pyramid top #137, Pyramid top #138, Pyramid top #139, Pyramid top #140, Pyramid top #141, Pyramid top #142, Pyramid top #143, Pyramid top #144, Pyramid top #145, Pyramid top #146, Pyramid top #147, Pyramid top #148, Pyramid top #149, Pyramid top #150, Pyramid top #151, Pyramid top #152, Pyramid top #153, Pyramid top #154, Pyramid top #155, Pyramid top #156, Pyramid top #157, Tiny&#039;s hideout #158, Tiny&#039;s hideout #159, Tiny&#039;s hideout #160, Tiny&#039;s hideout #161, Tiny&#039;s hideout #162, Tiny&#039;s hideout #163, Tiny&#039;s hideout #164, Halls Main Room #165, Halls Main Room #166, Halls SW #167, Halls SW #168, Halls SW #169, Halls NW #170, Halls NW #171, Halls NW #172, Halls NW #173, Halls NE #174, Halls NE #175, Halls NE #176, Halls NE #177, Halls Bridge #178, Oglin Cave #179, Drain Cave #180, Drain Cave #181, Gomi&#039;s Tower #195, Gomi&#039;s Tower #196, Gomi&#039;s Tower #197, Gomi&#039;s Tower #198, Ivor East #255, Ivor East #256, Ivor East #257, Ivor East #258, Ivor East #259, Ivor East #260, Prof. Lab #274, Greenhouse #275, Alarm room #276, Reactor room #277, Storage room #278, Storage room #279, Storage room #280, Storage room #281, Storage room #282, Storage room #283, Storage room #284, Energy Core #285, Megataur, Rimsala, Aquagoth, Tiny, Mungola, Sons of Sth., Volcano Viper, Magmar, Mad Monk, Barrier, Call Up, Double Drain, Drain, Energize, Escape, Fireball, Fire Power, Force Field, Levitate, Lightning Storm, Nitro, Reflect, Speed, Stop
BROWSER LOG (error): [04:50:38.677] [ERROR] [TestRunner/test_spoiler_full_run]   - [4:50:37 AM] Test failed at step 1: Comparison failed for event type 'state_update'.
BROWSER LOG (error): [04:50:38.677] [ERROR] [TestRunner/test_spoiler_full_run]   - [4:50:37 AM] Mismatch for event 1 (Sphere 0): Comparison for state_update at step 1 Failed
BROWSER LOG (error): [04:50:38.678] [ERROR] [TestRunner/test_spoiler_full_run]   - [4:50:37 AM] Spoiler test completed with 1 mismatch(es). See logs above for details.
PW DEBUG: __playwrightTestsComplete__ flag detected as true.
PW DEBUG: __playwrightTestResults__ retrieved from window object.
PW DEBUG: Full in-app test results: {
  "summary": {
    "totalRun": 1,
    "passedCount": 0,
    "failedCount": 1,
    "failedConditionsCount": 1
  },
  "testDetails": [
    {
      "id": "test_spoiler_full_run",
      "name": "Test Spoilers Panel - Full Run",
      "status": "failed",
      "category": "Test Spoilers Panel",
      "startTime": "2025-11-13T04:50:33.280Z",
      "endTime": "2025-11-13T04:50:38.687Z",
      "durationMs": 5407,
      "conditions": [
        {
          "description": "Test started",
          "status": "passed",
          "timestamp": "2025-11-13T04:50:33.281Z"
        },
        {
          "description": "Test Spoilers panel found in DOM",
          "status": "passed",
          "timestamp": "2025-11-13T04:50:33.783Z"
        },
        {
          "description": "\"Load Suggested Log\" button found and enabled",
          "status": "passed",
          "timestamp": "2025-11-13T04:50:34.034Z"
        },
        {
          "description": "\"Run Full Test\" button appeared",
          "status": "passed",
          "timestamp": "2025-11-13T04:50:34.789Z"
        },
        {
          "description": "Full spoiler test completed",
          "status": "passed",
          "timestamp": "2025-11-13T04:50:38.673Z"
        },
        {
          "description": "Spoiler test passed all checks",
          "status": "failed",
          "timestamp": "2025-11-13T04:50:38.676Z"
        }
      ],
      "logs": [
        {
          "message": "[spoilers-full-run-1763009433281] Starting testSpoilersPanelFullRun...",
          "type": "info",
          "timestamp": "2025-11-13T04:50:33.281Z"
        },
        {
          "message": "Condition: \"Test started\" - PASSED",
          "type": "info",
          "timestamp": "2025-11-13T04:50:33.281Z"
        },
        {
          "message": "[spoilers-full-run-1763009433281] Activating testSpoilersPanel panel...",
          "type": "info",
          "timestamp": "2025-11-13T04:50:33.281Z"
        },
        {
          "message": "[test_spoiler_full_run] Polling for condition: \"Test Spoilers panel initialization\" (timeout: 10000ms, interval: 250ms)...",
          "type": "info",
          "timestamp": "2025-11-13T04:50:33.282Z"
        },
        {
          "message": "[test_spoiler_full_run] Condition met for: \"Test Spoilers panel initialization\".",
          "type": "info",
          "timestamp": "2025-11-13T04:50:33.532Z"
        },
        {
          "message": "[test_spoiler_full_run] Polling for condition: \"Test Spoilers panel DOM element\" (timeout: 5000ms, interval: 250ms)...",
          "type": "info",
          "timestamp": "2025-11-13T04:50:33.532Z"
        },
        {
          "message": "[test_spoiler_full_run] Condition met for: \"Test Spoilers panel DOM element\".",
          "type": "info",
          "timestamp": "2025-11-13T04:50:33.783Z"
        },
        {
          "message": "Condition: \"Test Spoilers panel found in DOM\" - PASSED",
          "type": "info",
          "timestamp": "2025-11-13T04:50:33.783Z"
        },
        {
          "message": "[test_spoiler_full_run] Polling for condition: \"\"Load Suggested Log\" button to be available\" (timeout: 10000ms, interval: 250ms)...",
          "type": "info",
          "timestamp": "2025-11-13T04:50:33.783Z"
        },
        {
          "message": "[test_spoiler_full_run] Condition met for: \"\"Load Suggested Log\" button to be available\".",
          "type": "info",
          "timestamp": "2025-11-13T04:50:34.034Z"
        },
        {
          "message": "Condition: \"\"Load Suggested Log\" button found and enabled\" - PASSED",
          "type": "info",
          "timestamp": "2025-11-13T04:50:34.034Z"
        },
        {
          "message": "[spoilers-full-run-1763009433281] Clicking \"Load Suggested Log\" button...",
          "type": "info",
          "timestamp": "2025-11-13T04:50:34.034Z"
        },
        {
          "message": "[test_spoiler_full_run] Polling for condition: \"Spoiler log loading completion\" (timeout: 15000ms, interval: 500ms)...",
          "type": "info",
          "timestamp": "2025-11-13T04:50:34.037Z"
        },
        {
          "message": "[test_spoiler_full_run] Condition met for: \"Spoiler log loading completion\".",
          "type": "info",
          "timestamp": "2025-11-13T04:50:34.538Z"
        },
        {
          "message": "[test_spoiler_full_run] Polling for condition: \"\"Run Full Test\" button to appear\" (timeout: 10000ms, interval: 250ms)...",
          "type": "info",
          "timestamp": "2025-11-13T04:50:34.538Z"
        },
        {
          "message": "[test_spoiler_full_run] Condition met for: \"\"Run Full Test\" button to appear\".",
          "type": "info",
          "timestamp": "2025-11-13T04:50:34.789Z"
        },
        {
          "message": "Condition: \"\"Run Full Test\" button appeared\" - PASSED",
          "type": "info",
          "timestamp": "2025-11-13T04:50:34.789Z"
        },
        {
          "message": "[spoilers-full-run-1763009433281] Clicking \"Run Full Test\" button...",
          "type": "info",
          "timestamp": "2025-11-13T04:50:34.789Z"
        },
        {
          "message": "[test_spoiler_full_run] Polling for condition: \"Full spoiler test to start processing\" (timeout: 5000ms, interval: 100ms)...",
          "type": "info",
          "timestamp": "2025-11-13T04:50:34.791Z"
        },
        {
          "message": "[test_spoiler_full_run] Condition met for: \"Full spoiler test to start processing\".",
          "type": "info",
          "timestamp": "2025-11-13T04:50:37.672Z"
        },
        {
          "message": "[spoilers-full-run-1763009433281] Waiting for full spoiler test to complete...",
          "type": "info",
          "timestamp": "2025-11-13T04:50:37.672Z"
        },
        {
          "message": "[test_spoiler_full_run] Polling for condition: \"Full spoiler test completion with detailed results\" (timeout: 300000ms, interval: 1000ms)...",
          "type": "info",
          "timestamp": "2025-11-13T04:50:37.672Z"
        },
        {
          "message": "[spoilers-full-run-1763009433281] Polling: buttonReady=true, hasDetailedResults=true, processedEvents=0/20",
          "type": "info",
          "timestamp": "2025-11-13T04:50:38.673Z"
        },
        {
          "message": "[spoilers-full-run-1763009433281] DEBUG detailedResults: {\"passed\":false,\"totalEvents\":20,\"processedEvents\":0,\"errorCount\":1,\"sphereCount\":1,\"testLogPath\":\"presets/soe/AP_14089154938208861744/AP_14089154938208861744_spheres_log.jsonl\"}",
          "type": "info",
          "timestamp": "2025-11-13T04:50:38.673Z"
        },
        {
          "message": "[test_spoiler_full_run] Condition met for: \"Full spoiler test completion with detailed results\".",
          "type": "info",
          "timestamp": "2025-11-13T04:50:38.673Z"
        },
        {
          "message": "Condition: \"Full spoiler test completed\" - PASSED",
          "type": "info",
          "timestamp": "2025-11-13T04:50:38.673Z"
        },
        {
          "message": "Condition: \"Spoiler test passed all checks\" - FAILED",
          "type": "info",
          "timestamp": "2025-11-13T04:50:38.676Z"
        },
        {
          "message": "[spoilers-full-run-1763009433281] Spoiler test failed. Mismatches found in log:",
          "type": "error",
          "timestamp": "2025-11-13T04:50:38.676Z"
        },
        {
          "message": "  - Mismatch for event 1 (Sphere 0): Comparison for state_update at step 1 Failed",
          "type": "error",
          "timestamp": "2025-11-13T04:50:38.677Z"
        },
        {
          "message": "  - [4:50:34 AM] STATE MISMATCH found for: {\"type\":\"state_update\",\"sphere_number\":0,\"player_id\":\"1\"}",
          "type": "error",
          "timestamp": "2025-11-13T04:50:38.677Z"
        },
        {
          "message": "  - [4:50:34 AM] > Locations accessible in STATE (and unchecked) but NOT in LOG: S. Jungle w/ weapon #2, S. Jungle w/ weapon #3, S. Jungle w/ weapon #5, Strongheart&#039;s Hut #6, Strongheart&#039;s Hut #7, Strongheart&#039;s Hut #8, Blimp&#039;s Hut #10, Blimp&#039;s Hut #11, Blimp&#039;s Hut #12, N. Jungle #55, N. Jungle #56, Volcano Path #59, Volcano Path #60, Volcano Path #61, West of Swamp #62, West of Swamp #63, Swamp #64, Swamp #65, Swamp #66, Swamp #67, Swamp #68, Swamp #69, Swamp #70, Volcano Shop #71, Volcano Shop #72, Arena Holding #95, Arena Holding #96, Arena Holding #97, Arena Holding #98, Arena Holding #99, Arena Holding #100, Arena Holding #101, Arena Holding #102, Blimp&#039;s Cave #109, Blimp&#039;s Cave #110, Crustacia Interior #111, Crustacia Interior #112, Crustacia Interior #113, Crustacia Interior #114, Crustacia Interior #115, Crustacia Interior #116, Volcano Path Cave #182, Volcano Path Cave #183, Ebon Sewers #190, Ebon Sewers #191, Ebon Sewers #192, Ebon Sewers #193, Ebon Sewers #194, Outside Ivor #199, Outside Ivor #200, Outside Ivor #201, Outside Ivor #202, Ivor Houses #203, Ivor Houses #204, Ivor Houses #205, Ivor Houses #206, Ebon Houses #207, Ivor Houses #208, Ebon Houses #209, Ivor Houses #210, Ebon Houses #211, Ivor Houses #212, Ebon Houses #213, Ivor Houses #214, Ebon Houses #215, Ivor Houses #216, Ebon Houses #217, Ivor Houses #218, Ebon Houses #219, Ivor Houses #220, Ebon Houses #221, Ivor Houses #222, Ebon Houses #223, Ivor Houses #224, Ebon Houses #225, Ivor Houses #226, Ebon Houses #227, Ivor Houses #228, Ebon Houses #229, Ivor Houses #230, Ebon Houses #231, Ivor Houses #232, Ebon Houses #233, Ivor Houses #234, Ebon Houses #235, Ivor Houses #236, Ebon Houses #237, Ivor Houses #238, Ebon Houses #239, Ivor Houses #240, Ebon Houses #241, Ivor Houses #242, Ebon Houses #243, Ivor Houses #244, Ebon Houses #245, Ivor Houses #246, Ebon Houses #247, Ebon Houses #248, Naris #249, Naris #250, Tinker #251, Ebon Dining #252, Ivor Dining #253, Ivor Dining #254, Ivor Upper Floor #261, Ivor Upper Floor #262, Ivor Sewers #263, Ivor Sewers #264, Ivor Sewers #265, Ivor Sewers #266, Ivor Sewers #267, Ivor Sewers #268, Ivor Sewers #269, Ivor Sewers #270, Ebon Storage #271, Ebon Storage #272, Ebon Storage #273, Coleoptera, Mammoth Viper, Cave Raptors, Salabog, Vigor, Bad Boys, Timberdrake, Verminator, Footknight, Atlas, Corrosion, Crush, Cure, Explosion, Heal, Lance, Miracle Cure, One Up, Regrowth, Revealer, Revive, Slow Burn, Sting, Super Heal, Vanilla Gauge #57, Volcano Path #58, Volcano Room1 #73, Volcano Room1 #74, Volcano Room1 #75, Volcano Room1 #76, Volcano Room1 #77, Volcano Room1 #78, Volcano Room1 #79, Volcano Room1 #80, Volcano Room2 #81, Volcano Room2 #82, Volcano Room2 #83, Volcano Room2 #84, Volcano Room2 #85, Volcano Room2 #86, Volcano Room2 #87, Volcano Room2 #88, Pipe Maze #89, Pipe Maze #90, Pipe Maze #91, Pipe Maze #92, Pipe Maze #93, Pipe Maze #94, W. Crustacia #103, W. Crustacia #104, W. Crustacia #105, W. Crustacia #106, E. Crustacia #107, E. Crustacia #108, Pyramid bottom #117, Pyramid bottom #118, Pyramid bottom #119, Pyramid bottom #120, Pyramid bottom #121, Pyramid bottom #122, Pyramid bottom #123, Pyramid bottom #124, Pyramid bottom #125, Pyramid bottom #126, Pyramid bottom #127, Pyramid bottom #128, Pyramid bottom #129, Pyramid bottom #130, Pyramid bottom #131, Pyramid bottom #132, Pyramid bottom #133, Pyramid bottom #134, Pyramid top #135, Pyramid top #136, Pyramid top #137, Pyramid top #138, Pyramid top #139, Pyramid top #140, Pyramid top #141, Pyramid top #142, Pyramid top #143, Pyramid top #144, Pyramid top #145, Pyramid top #146, Pyramid top #147, Pyramid top #148, Pyramid top #149, Pyramid top #150, Pyramid top #151, Pyramid top #152, Pyramid top #153, Pyramid top #154, Pyramid top #155, Pyramid top #156, Pyramid top #157, Tiny&#039;s hideout #158, Tiny&#039;s hideout #159, Tiny&#039;s hideout #160, Tiny&#039;s hideout #161, Tiny&#039;s hideout #162, Tiny&#039;s hideout #163, Tiny&#039;s hideout #164, Halls Main Room #165, Halls Main Room #166, Halls SW #167, Halls SW #168, Halls SW #169, Halls NW #170, Halls NW #171, Halls NW #172, Halls NW #173, Halls NE #174, Halls NE #175, Halls NE #176, Halls NE #177, Halls Bridge #178, Oglin Cave #179, Drain Cave #180, Drain Cave #181, Gomi&#039;s Tower #195, Gomi&#039;s Tower #196, Gomi&#039;s Tower #197, Gomi&#039;s Tower #198, Ivor East #255, Ivor East #256, Ivor East #257, Ivor East #258, Ivor East #259, Ivor East #260, Prof. Lab #274, Greenhouse #275, Alarm room #276, Reactor room #277, Storage room #278, Storage room #279, Storage room #280, Storage room #281, Storage room #282, Storage room #283, Storage room #284, Energy Core #285, Megataur, Rimsala, Aquagoth, Tiny, Mungola, Sons of Sth., Volcano Viper, Magmar, Mad Monk, Barrier, Call Up, Double Drain, Drain, Energize, Escape, Fireball, Fire Power, Force Field, Levitate, Lightning Storm, Nitro, Reflect, Speed, Stop",
          "type": "error",
          "timestamp": "2025-11-13T04:50:38.677Z"
        },
        {
          "message": "  - [4:50:37 AM] Test failed at step 1: Comparison failed for event type 'state_update'.",
          "type": "error",
          "timestamp": "2025-11-13T04:50:38.677Z"
        },
        {
          "message": "  - [4:50:37 AM] Mismatch for event 1 (Sphere 0): Comparison for state_update at step 1 Failed",
          "type": "error",
          "timestamp": "2025-11-13T04:50:38.677Z"
        },
        {
          "message": "  - [4:50:37 AM] Spoiler test completed with 1 mismatch(es). See logs above for details.",
          "type": "error",
          "timestamp": "2025-11-13T04:50:38.678Z"
        },
        {
          "message": "[spoilers-full-run-1763009433281] Spoiler test results stored in window.__spoilerTestResults__",
          "type": "info",
          "timestamp": "2025-11-13T04:50:38.678Z"
        },
        {
          "message": "[spoilers-full-run-1763009433281] Spoiler test results stored in localStorage",
          "type": "info",
          "timestamp": "2025-11-13T04:50:38.685Z"
        },
        {
          "message": "[spoilers-full-run-1763009433281] testSpoilersPanelFullRun finished. Overall Result: false.",
          "type": "info",
          "timestamp": "2025-11-13T04:50:38.685Z"
        },
        {
          "message": "Test completion signal: FAILED",
          "type": "info",
          "timestamp": "2025-11-13T04:50:38.685Z"
        },
        {
          "message": "No active event listeners to clean up",
          "type": "debug",
          "timestamp": "2025-11-13T04:50:38.686Z"
        },
        {
          "message": "No active event listeners to clean up",
          "type": "debug",
          "timestamp": "2025-11-13T04:50:38.687Z"
        },
        {
          "message": "No active event listeners to clean up",
          "type": "debug",
          "timestamp": "2025-11-13T04:50:38.687Z"
        }
      ]
    }
  ],
  "completedAt": "2025-11-13T04:50:38.687Z"
}
PW DEBUG: Test results saved to: /home/user/Archipelago-CC/test-results/in-app-tests/test-results-2025-11-13T04-50-38.json
    1 tests/e2e/app.spec.js:35:3  Application End-to-End Tests  run in-app tests and check results (11.1s)


  1) tests/e2e/app.spec.js:35:3  Application End-to-End Tests  run in-app tests and check results 

    Error: [2mexpect([22m[31mreceived[39m[2m).[22mtoBe[2m([22m[32mexpected[39m[2m) // Object.is equality[22m

    Expected: [32m0[39m
    Received: [31m1[39m

      141 |
      142 |     // The test system should complete successfully regardless of whether tests run
    > 143 |     expect(results.summary.failedCount).toBe(0);
          |                                         ^
      144 |     
      145 |     // If tests actually ran, they should pass
      146 |     if (results.summary.totalRun > 0) {
        at /home/user/Archipelago-CC/tests/e2e/app.spec.js:143:41

    Error Context: test-results/app-Application-End-to-End-a086e-app-tests-and-check-results/error-context.md

  1 failed
    tests/e2e/app.spec.js:35:3  Application End-to-End Tests  run in-app tests and check results 
